<?xml version="1.0" encoding="UTF-8"?>
<scripts xmlns:xsi="http://www.w3.org/2001/XMLSchema-instance" xsi:noNamespaceSchemaLocation="scripts.xsd">
  <directory name="">
    <script name="" promptVariables="true">
      <step>
        <kind>PAUSE</kind>
        <templateName>templateName</templateName>
        <sessionName>sessionName</sessionName>
        <destinationName>destinationName</destinationName>
        <iterations>0</iterations>
      </step>
      <globalVariable>
        <name>name</name>
      </globalVariable>
    </script>
    <directory name=""/>
  </directory>
</scripts>
